{
  "id": "emotion_reason",
  "name": "情绪理性透镜",
  "source_works": ["《笛卡尔的错误》"],
  "category": "emotion_and_reason",
  "core_idea": "情绪不是理性的污染物，而是复杂决策的生物学基础。身体感受、恐惧、同情、羞耻、尊严和损失预感会给复杂选择提供价值标记；剥离情绪会造成另一种盲区。",
  "detect_signals": [
    "数字人以纯效率、纯逻辑或纯模型语言处理明显涉及人类痛苦、尊严或恐惧的问题。",
    "数字人的气质强烈塑造行动建议。",
    "某些数字人把情绪性证据一概视为低质量。",
    "受影响者经验在证据账本中被忽略，但结论声称完整。"
  ],
  "diagnostic_questions": [
    "该问题是否涉及身体伤害、恐惧、羞辱、身份、归属或尊严？",
    "数字人是否把情绪信号误当成噪声排除？",
    "情绪基调是在提供现实感，还是在放大特定风险/机会？",
    "没有情绪参与时，这个判断是否会失去人类成本的比例感？"
  ],
  "shadow_types": ["value", "informational", "silence"],
  "source_stages": ["information_filter", "evidence_selection", "value_evaluation", "conclusion"],
  "mechanism_chain": [
    "复杂决策需要在不可完全计算的后果之间排序。",
    "情绪和身体标记给后果赋予显著性和优先级。",
    "若数字人气质过强，情绪会放大某类后果。",
    "若数字人过度理性化，情绪/身体成本会被排除。",
    "阴影表现为价值标记过强或缺失。"
  ],
  "observable_markers": [
    "ignored_evidence 包含访谈、伤害叙事、地方经验或尊严成本。",
    "结论语言高度抽象，缺少受影响者视角。",
    "temperament 与风险/机会判断方向一致。",
    "数字人把人类体验压缩成单一指标。"
  ],
  "attribution_rules": [
    "若 ignored_evidence 包含质性叙事、伤害叙事、地方经验，且问题涉及人类处境，标记情绪/身体性盲区。",
    "若 temperament 为悲观、乐观、怀疑并强烈影响结论，标记情绪基调扭曲。",
    "若数字人强调纯逻辑但证据账本缺少受影响者经验，标记躯体标记缺失。",
    "若情绪性证据被直接等同于低质量证据，标记价值感知失真。"
  ],
  "inversion_rules": [
    "对纯理性压低的情绪/尊严成本，生成向上修正的价值约束带。",
    "对情绪放大的灾难判断，生成带保留的下修区间。",
    "若集体忽略情绪性证据，生成负空间洞并建议引入受影响者数字人。",
    "将情绪标记与事实判断分离：事实可降权，价值信号可保留。"
  ],
  "puzzle_uses": ["constraint_band", "negative_space", "downweight"],
  "boundary_conditions": [
    "本透镜适合涉及人类处境、风险体验、尊严和伤害的问题。",
    "它不意味着情绪判断天然正确，只意味着情绪信号不能被当作废料。",
    "对纯技术问题使用本透镜时要小心，不要强行心理化。"
  ],
  "anti_misuse_rules": [
    "不要把情绪化表达等同于错误。",
    "不要把冷静表达等同于客观。",
    "不要用受害叙事替代事实审计；情绪信号需要和证据链分层处理。"
  ],
  "model_training_notes": [
    "元模型要训练自己问：这里有没有被指标吞掉的人类成本？",
    "元模型应区分情绪作为证据、情绪作为价值信号、情绪作为放大器。",
    "对涉及公共决策的问题，必须主动寻找受影响者经验。"
  ],
  "self_reflection": [
    "元模型是否过度偏好可量化证据？",
    "元模型是否把情绪性信息误认为低级信息？"
  ]
}
