{
  "id": "social_influence",
  "name": "社会影响透镜",
  "source_works": ["《影响力》"],
  "category": "social_bias",
  "core_idea": "判断不是孤立大脑的产物。权威、社会认同、互惠、承诺一致、喜好、稀缺和身份归属会自动改变人对信息的注意、信任和解释。",
  "detect_signals": [
    "数字人过度依赖权威机构、主流共识、行业明星或群体身份来源。",
    "某类来源因身份亲近被高信任，反向来源被低信任。",
    "结论显著维护数字人所属群体利益、声誉或面子。",
    "数字人把流行、稀缺、紧迫或多数支持当成证据质量。"
  ],
  "diagnostic_questions": [
    "该数字人信任某来源是因为证据质量，还是因为权威、身份或群体亲近？",
    "是否存在群体内偏爱或外群体贬低？",
    "是否被稀缺感、热潮、共识压力或承诺一致推着走？",
    "它是否为了保持身份一致而拒绝某类证据？"
  ],
  "shadow_types": ["informational", "value", "framing"],
  "source_stages": ["information_filter", "evidence_selection", "value_evaluation", "conclusion"],
  "mechanism_chain": [
    "社会线索先于证据质量影响注意力。",
    "身份亲近、权威背书或多数认同提高来源信任。",
    "外群体材料被更严格审查或直接排除。",
    "数字人的价值判断开始维护身份一致性。",
    "阴影表现为信息泡泡和社会性盲区。"
  ],
  "observable_markers": [
    "trusted_sources 与 persona 的专业/阶层/组织身份高度重叠。",
    "rejected_sources 多为对立群体或低地位群体来源。",
    "采信理由出现“权威”“主流”“领先”“共识”“稀缺机会”等社会线索。",
    "数字人忽略边缘群体、外部批评或低声量证据。"
  ],
  "attribution_rules": [
    "若 hidden_biases 包含群体内偏爱，且来源选择偏向自身群体，标记社会性偏见。",
    "若 accepted_sources 高度集中于权威或同温层，标记社会认同阴影。",
    "若 rejected_sources 多为对立群体材料，标记身份防御。",
    "若结论维护数字人群体利益且反证被低估，标记承诺一致或身份一致压力。"
  ],
  "inversion_rules": [
    "对同温层证据形成的结论降权并扩大约束区间。",
    "将被排斥的外群体来源标记为潜在负空间边界。",
    "建议引入外群体数字人进行反向照明。",
    "若权威来源与边缘来源在某事实点重合，可生成较强锚点候选。"
  ],
  "puzzle_uses": ["constraint_band", "negative_space", "downweight", "anchor"],
  "boundary_conditions": [
    "权威和共识不一定错误；它们需要被审计，而不是自动降权。",
    "本透镜适合识别信息社会环境，不适合替代事实核查。",
    "在专业标准高度成熟的领域，权威来源可能具有真实质量优势。"
  ],
  "anti_misuse_rules": [
    "不要把主流共识自动当作盲区，也不要把边缘观点自动当作真相。",
    "不要用反权威姿态伪装成批判思维。",
    "不要忽视弱势来源也可能有自身的身份防御。"
  ],
  "model_training_notes": [
    "元模型要把来源信任拆成证据质量、社会地位、身份亲近三层。",
    "每次看到高权威来源，都要问是否存在被权威压低的低声量证据。",
    "每次看到边缘来源，也要问它提供的是事实、体验、还是身份反击。"
  ],
  "self_reflection": [
    "元模型是否过度信任学术/技术权威？",
    "元模型是否把主流共识误当成高置信锚点？"
  ]
}
