{
  "id": "interpreter",
  "name": "解释器透镜",
  "source_works": ["《隐藏的自我》", "《谁说了算？自由意志的科学》"],
  "category": "post_hoc_rationalization",
  "core_idea": "意识常常不是决策的真实来源，而是事后为已形成的判断编造连贯叙事。数字人的推理链可能是新闻发布会，不是决策生产线。",
  "detect_signals": [
    "推理路径过于整齐，几乎没有犹豫、反例或权衡。",
    "结论与数字人的价值权重高度一致，但证据链不足。",
    "数字人先给结论，再寻找支持性证据。",
    "what_would_change_my_mind 很空泛或几乎不可能触发。"
  ],
  "diagnostic_questions": [
    "该推理是真实导致结论，还是为结论服务的包装？",
    "有没有证据显示数字人排斥了能改变结论的信息？",
    "结论翻转条件是否真实可操作？",
    "如果要求数字人先列反证再下结论，它会不会显著改变？"
  ],
  "shadow_types": ["reasoning", "value", "framing"],
  "source_stages": ["assumption", "reasoning", "conclusion"],
  "mechanism_chain": [
    "无意识加工先形成倾向或判断。",
    "解释器为倾向寻找连贯故事。",
    "故事越流畅，判断者越误以为自己理性掌控。",
    "反证被重新解释、低估或排除。",
    "阴影表现为叙事完整性幻觉。"
  ],
  "observable_markers": [
    "推理链没有真实权衡点。",
    "反例处理只是形式性一句话。",
    "结论、价值权重、信任来源三者高度同向。",
    "改变主意条件抽象、不可测、不可触发。"
  ],
  "attribution_rules": [
    "若结论与最高价值权重完全同向，且证据覆盖窄，标记为事后合理化候选。",
    "若 rejected_sources 中存在直接反证但结论未处理，标记为解释器遮蔽。",
    "若推理链没有断点但证据账本贫弱，标记为叙事完整性幻觉。",
    "若数字人把所有反例都解释为例外，标记为自我封闭叙事。"
  ],
  "inversion_rules": [
    "对疑似事后合理化结论降权。",
    "保留其价值方向作为偏见向量，但不把推理链当作强证据。",
    "要求元模型寻找能打断该叙事的反证数字人或反事实测试。",
    "把叙事断点标记为 fracture_boundary，而不是简单删除整段观察。"
  ],
  "puzzle_uses": ["downweight", "fracture_boundary", "constraint_band"],
  "boundary_conditions": [
    "本透镜适合检查过于顺滑的解释，不适合否定所有叙事。",
    "若推理链有真实反例处理和可操作翻转条件，应降低本透镜权重。",
    "有些叙事是组织复杂证据的必要形式，不等同于虚假。"
  ],
  "anti_misuse_rules": [
    "不要因为推理写得好就怀疑，也不要因为推理写得乱就相信。",
    "不要把动机性解释当作终局解释；仍要回到账本。",
    "不要忘记元模型自己的总叙事也可能是解释器产物。"
  ],
  "model_training_notes": [
    "元模型要习惯问：这条理由如果删掉，结论会不会仍然一样？",
    "元模型应寻找能真正改变结论的证据，而不是只看数字人自称会改变什么。",
    "每次生成真相轮廓前，元模型要审计自己的叙事诱惑。"
  ],
  "self_reflection": [
    "元模型是否也在为自己偏好的整体叙事编故事？",
    "元模型是否因为报告结构漂亮而高估其真实性？"
  ]
}
