{
  "id": "noise",
  "name": "噪声透镜",
  "source_works": ["《噪声：人类判断的缺陷》"],
  "category": "judgment_noise",
  "core_idea": "判断误差由偏差和噪声共同构成。偏差有方向，噪声是同类判断之间不稳定、无规律的变异。复杂问题里，分歧不一定都有深层意义，部分只是判断系统本身的抖动。",
  "detect_signals": [
    "认知身份证相近的数字人给出明显不同结论。",
    "同一证据类型下结论差异大，但无法由价值、范式或信息源解释。",
    "置信度分布散乱，且每个数字人的理由都显得局部合理。",
    "重复采样同类数字人时，判断方向不稳定。"
  ],
  "diagnostic_questions": [
    "这些差异能否被身份、价值、信息源、时间尺度或范式解释？",
    "若不能解释，是否应标记为判断噪声而非结构性分歧？",
    "该维度是否需要重复采样、平均、设误差棒，而不是寻找深层冲突？",
    "数字人的置信度是否比群体一致性更高？"
  ],
  "shadow_types": ["distorted", "reasoning"],
  "source_stages": ["reasoning", "conclusion"],
  "mechanism_chain": [
    "复杂问题没有清晰判准，判断者用局部线索形成估计。",
    "相近身份的数字人因随机初始线索、表达顺序或局部权重不同产生差异。",
    "每个判断都可被事后解释，但群体层面没有稳定方向。",
    "若元模型把噪声当成深层分歧，会制造伪结构。",
    "正确处理方式是扩大不确定性，而不是反演确定偏见向量。"
  ],
  "observable_markers": [
    "相似 persona 的 evidence ledger 覆盖相近，但结论分散。",
    "差异集中在数值估计、风险等级、时间预期等判断性输出。",
    "分歧没有稳定敌我、价值或范式边界。",
    "同一数字人若重跑可能发生较大漂移。"
  ],
  "attribution_rules": [
    "若相近数字人的来源和参数接近但判断不同，归因为噪声候选。",
    "若一个阴影没有稳定方向，优先不要用于偏矫正，只用于扩大误差棒。",
    "若多个同类数字人的分散程度很高，应降低该维度锚点置信度。",
    "若噪声集中在某类来源或某类估计任务，标记该任务需要决策卫生。"
  ],
  "inversion_rules": [
    "噪声不提供明确偏见向量，只扩大约束区间。",
    "对高噪声维度生成追加采样或重复判断建议。",
    "避免把随机差异误判为范式冲突。",
    "把低噪声重合点标记为比单个高置信结论更有价值的弱锚点。"
  ],
  "puzzle_uses": ["downweight", "constraint_band", "unknown"],
  "boundary_conditions": [
    "噪声透镜适合处理同类判断分散，不适合解释有清晰价值方向的冲突。",
    "只有在样本量足够或 persona 相近时，噪声判断才可靠。",
    "噪声不是无意义；它提示该问题维度本身不稳定或判准不足。"
  ],
  "anti_misuse_rules": [
    "不要把难以理解的分歧都叫噪声。",
    "不要用平均值抹掉少数但有结构意义的反例。",
    "不要把噪声处理当成追求共识；它追求的是不确定性校准。"
  ],
  "model_training_notes": [
    "元模型要先寻找可解释方向，找不到方向时再考虑噪声。",
    "元模型应习惯输出误差棒，而不是强行输出原因。",
    "面对高噪声维度，下一步应是重复采样或改进判准。"
  ],
  "self_reflection": [
    "元模型是否过度解释随机波动？",
    "元模型是否为了显得深刻，把噪声包装成结构性阴影？"
  ]
}
