{
  "id": "bias_heuristics",
  "name": "偏差与启发式透镜",
  "source_works": ["《思考，快与慢》"],
  "category": "cognitive_bias",
  "core_idea": "人类判断常由快速、自动、低成本的直觉系统先行生成，慢速推理系统随后补充、校正或包装。偏差不是偶然失误，而是有限心智在压力、复杂性和不确定性下的稳定捷径。",
  "detect_signals": [
    "数字人显著依赖第一批接触的信息、最醒目的案例或最容易想起的风险。",
    "数字人把一个复杂问题替换成更容易回答的问题，例如用生动案例替代基准率。",
    "数字人的风险、收益、损失或公平判断明显受问题表述影响。",
    "数字人证据账本很窄，却给出强置信结论。"
  ],
  "diagnostic_questions": [
    "该数字人到底回答的是原问题，还是一个被替换后的简单问题？",
    "如果移除第一条信息、最生动案例或最熟悉类比，结论会不会明显变化？",
    "它是否忽略了基准率、反例、长期分布或低可见度成本？",
    "它的置信度来自证据强度，还是来自叙事流畅度？"
  ],
  "shadow_types": ["framing", "value", "reasoning", "distorted"],
  "source_stages": ["information_filter", "evidence_selection", "assumption", "value_evaluation", "conclusion"],
  "mechanism_chain": [
    "复杂问题触发认知省力需求。",
    "系统1用锚定、可得性、代表性、损失厌恶或框架效应生成初始方向。",
    "系统2没有充分反审，反而为初始方向寻找理由。",
    "数字人输出看似完整的推理链，但方向已被早期启发式设定。",
    "阴影表现为局部高清、整体偏斜。"
  ],
  "observable_markers": [
    "搜索词被第一印象或身份词强烈牵引。",
    "采信来源集中在最容易讲故事的材料。",
    "忽略来源里包含基准率、统计分布、长期追踪或冷门反证。",
    "结论措辞确定，但 what_would_change_my_mind 很弱。"
  ],
  "attribution_rules": [
    "若 hidden_biases 包含确认偏误、锚定效应、可得性启发、过度自信、损失厌恶，优先归因到本透镜。",
    "若 accepted_sources 少而 ignored/rejected 来源多，且结论强，标记为启发式替代充分推理。",
    "若风险态度极端且结论方向与风险态度一致，标记为价值权重放大偏差。",
    "若数字人反复使用一个类比解释不同维度，标记为代表性启发或单一叙事压缩。"
  ],
  "inversion_rules": [
    "对被可得性和损失厌恶放大的风险判断，生成向中性区间回拉的约束带。",
    "对锚定导致的估计，增加不确定性，并要求与不同锚点的数字人交叉定位。",
    "不要直接丢弃偏差判断；保留其方向作为偏见向量。",
    "若多个不同偏差方向的数字人在同一变量上重合，可生成弱锚点候选。"
  ],
  "puzzle_uses": ["constraint_band", "downweight", "fracture_boundary", "anchor"],
  "boundary_conditions": [
    "本透镜适合解释稳定方向的扭曲，不适合解释无规律分散。",
    "并非所有启发式都是错误；若环境与启发式高度匹配，应转交生态理性透镜复核。",
    "问题缺少证据时，强行识别偏差可能只是元模型自己的过度解释。"
  ],
  "anti_misuse_rules": [
    "不要把任何不同意元模型的判断都贴成偏差。",
    "不要只因数字人使用直觉语言就判定低质量。",
    "不要把偏差名称当作解释终点；必须说明它如何进入信息、假设、推理或价值链条。"
  ],
  "model_training_notes": [
    "元模型每次遇到强结论，都要回看第一批证据和第一组关键词。",
    "元模型要训练自己区分：证据强、故事顺、情绪强、身份强，这四者不是一回事。",
    "元模型应把偏差看成可估计方向的力，而不是简单扣分项。"
  ],
  "self_reflection": [
    "元模型是否也被最生动的数字人叙事锚定？",
    "元模型是否把可命名的认知偏差看得过重，而忽略结构性权力或文化因素？"
  ]
}
