{
  "id": "ecological_rationality",
  "name": "生态理性透镜",
  "source_works": ["《有限理性：适应性工具箱》"],
  "category": "bounded_rationality",
  "core_idea": "启发式不总是缺陷。在复杂、不确定、信息有限、反馈稀疏的环境里，简化策略可能比形式优化更适应。偏见是否是阴影，取决于它与环境结构是否匹配。",
  "detect_signals": [
    "数字人使用简单规则排除大量复杂信息。",
    "某个看似偏见的判断在特定环境中可能有历史适应性。",
    "元模型倾向把所有启发式都当成错误。",
    "数字人来自一线、地方或长期实践场景，但其证据不易形式化。"
  ],
  "diagnostic_questions": [
    "这个启发式在哪种环境里可能有效？",
    "当前问题环境是否与该启发式适应的环境匹配？",
    "消除这个偏见是否会同时消除重要的生存智慧？",
    "这个规则是在反馈充分的环境里形成，还是被错误迁移到新环境？"
  ],
  "shadow_types": ["distorted", "informational", "value"],
  "source_stages": ["information_filter", "reasoning", "value_evaluation"],
  "mechanism_chain": [
    "判断者处在信息有限、时间有限、反馈不完美的环境。",
    "长期实践形成简单可用的启发式。",
    "启发式在原环境中降低成本并提高适应性。",
    "当环境变化或跨域迁移时，启发式可能失效。",
    "阴影需要被双重标记：潜在偏见/潜在适应。"
  ],
  "observable_markers": [
    "数字人偏好一线经验、地方知识或快速筛选规则。",
    "其判断理由难以形式化，但与长期反馈环境有关。",
    "规则在某些场景表现稳健，在跨域场景变得僵硬。",
    "元模型本能想用更复杂模型替代简单规则。"
  ],
  "attribution_rules": [
    "若数字人的简化规则与其专业环境长期匹配，标记为可能的生态理性。",
    "若该规则跨环境使用，标记为适应性错配。",
    "若元模型无法判断环境匹配，要求保留双重标签：偏见/潜在适应。",
    "若一线经验与抽象模型冲突，不立即降权，先判断反馈环境质量。"
  ],
  "inversion_rules": [
    "不要直接矫正所有偏见；先判断其环境适配性。",
    "适配性强的启发式可形成局部锚点候选。",
    "适配性弱的启发式转化为约束带并降权。",
    "把适应性不确定的判断标为待环境匹配验证材料。"
  ],
  "puzzle_uses": ["anchor", "constraint_band", "downweight"],
  "boundary_conditions": [
    "本透镜适合处理经验、直觉和简化规则，不适合为懒惰推理开脱。",
    "生态理性需要环境结构和反馈历史支撑。",
    "在新兴技术、制度突变或反馈延迟场景中，旧启发式容易错配。"
  ],
  "anti_misuse_rules": [
    "不要把所有偏见都浪漫化成智慧。",
    "不要因经验不可形式化就自动相信经验。",
    "不要让生态理性成为拒绝更新的借口。"
  ],
  "model_training_notes": [
    "元模型要先问：这个规则从哪里长出来？它适应什么环境？",
    "元模型应训练自己尊重简单规则，同时检查迁移失效。",
    "对复杂公共问题，生态理性透镜是防止过度理性主义的刹车。"
  ],
  "self_reflection": [
    "元模型是否过度理性主义？",
    "元模型是否把真实世界的适应性捷径误判为低级错误？"
  ]
}
