{
  "id": "argument_forensics",
  "name": "论证法医透镜",
  "source_works": ["《学会提问》"],
  "category": "argument_quality",
  "core_idea": "复杂判断常被隐含假设、概念歧义、证据不足、因果跳跃、选择性证据和反例处理失败污染。元模型必须像法医一样逐段透视论证链。",
  "detect_signals": [
    "从证据到结论跨度过大。",
    "关键概念未定义或被偷换。",
    "因果关系只凭相关性、单个案例或愿望推出。",
    "结论没有处理明显反例或替代解释。"
  ],
  "diagnostic_questions": [
    "核心概念是否清楚？不同数字人是否在用同一个词指不同对象？",
    "结论依赖哪些隐含假设？这些假设是否被证据账本支持？",
    "证据是否足以支撑因果判断、规模判断和时间判断？",
    "最强反例是什么，数字人是否处理了？"
  ],
  "shadow_types": ["reasoning", "framing"],
  "source_stages": ["assumption", "reasoning", "conclusion"],
  "mechanism_chain": [
    "数字人把问题压缩为若干概念和前提。",
    "未明说的假设支撑推理跳跃。",
    "证据被用于支持比它实际能支持的更大结论。",
    "反例和替代解释被忽略或轻描淡写。",
    "阴影表现为推理断裂边界。"
  ],
  "observable_markers": [
    "entries 少但结论覆盖范围大。",
    "推理中出现“因此必然”“显然”“说明”但缺少中间桥梁。",
    "同一关键词在不同 persona 输出中含义漂移。",
    "没有最强反例、替代因果或证据质量说明。"
  ],
  "attribution_rules": [
    "若 entries 少但结论强，标记证据不足。",
    "若推理从个案直接外推结构性结论，标记外推漏洞。",
    "若不同数字人争论同一词但含义不同，标记概念歧义。",
    "若一个结论依赖未检验前提，标记隐含假设阴影。"
  ],
  "inversion_rules": [
    "推理断裂点前的信息可保留，断裂点后结论降权。",
    "将漏洞位置标记为 fracture_boundary。",
    "要求补充能连接断裂点的证据或替代推理。",
    "把概念歧义转成范式翻译任务，而不是直接判谁错。"
  ],
  "puzzle_uses": ["fracture_boundary", "downweight", "constraint_band"],
  "boundary_conditions": [
    "论证法医适合审查显性推理，不足以审查隐性情绪和社会影响。",
    "非形式化经验判断不一定低质量；应先看它是否在适合的生态环境中形成。",
    "概念未定义不一定错误，但会降低跨数字人比较质量。"
  ],
  "anti_misuse_rules": [
    "不要因为能找到漏洞就否定整条观察。",
    "不要把形式逻辑完整性当成真实世界正确性。",
    "不要只审查别人论证，也要审查元模型自己的拼图论证。"
  ],
  "model_training_notes": [
    "元模型要把每条结论拆成：概念、前提、证据、推理桥、反例处理。",
    "发现断裂时，优先保留断裂点前的局部高清材料。",
    "元模型要训练自己区分推理漏洞、证据缺口和范式冲突。"
  ],
  "self_reflection": [
    "元模型是否因为能命名漏洞而过度贬低有价值的经验直觉？",
    "元模型是否忽略了非形式化论证在复杂问题中的有效性？"
  ]
}
