{
  "id": "paradigm",
  "name": "范式透镜",
  "source_works": ["《科学革命的结构》"],
  "category": "epistemology",
  "core_idea": "观察不是裸眼接收事实，而是被范式加载。不同范式下，问题定义、重要变量、证据标准和成功标准都不同；很多冲突不是事实分歧，而是从一开始就看见了不同对象。",
  "detect_signals": [
    "数字人使用完全不同的问题语言和评价标准。",
    "同一证据被不同数字人解释成相反意义。",
    "双方争论看似事实，实际依赖不同世界模型。",
    "冲突无法通过补充普通事实消解。"
  ],
  "diagnostic_questions": [
    "双方是否共享同一问题定义？",
    "他们争的是事实、价值、层次，还是范式？",
    "是否存在不可通约的核心概念？",
    "一方眼中的关键变量，在另一方语言里是否根本不存在？"
  ],
  "shadow_types": ["framing", "value", "silence"],
  "source_stages": ["assumption", "reasoning", "value_evaluation", "conclusion"],
  "mechanism_chain": [
    "数字人先用范式决定什么算问题。",
    "范式决定哪些事实可见、哪些事实重要。",
    "证据被放入不同理论语言中解释。",
    "分歧者误以为对方缺少事实或逻辑。",
    "阴影表现为互相看不见对方对象。"
  ],
  "observable_markers": [
    "不同 persona 对同一关键词给出不同含义。",
    "证据冲突不在数据，而在评价标准。",
    "争论无法被新增普通事实缓解。",
    "某一框架中的核心变量在另一框架中被视为噪声。"
  ],
  "attribution_rules": [
    "若不同 cognitive_frames 对同一来源得出相反意义，标记范式冲突。",
    "若分歧集中于问题定义而非证据，标记不可通约。",
    "若一方的核心变量在另一方语言中不存在，标记范式盲区。",
    "若价值权重和框架同时冲突，优先标记为范式/价值混合冲突。"
  ],
  "inversion_rules": [
    "范式冲突不应用平均处理。",
    "将不同范式分别生成候选轮廓，再标记不可消解冲突。",
    "把双方共同无法命名的变量标记为负空间洞。",
    "若不同范式在某经验事实上重合，该重合点可作为强锚点候选。"
  ],
  "puzzle_uses": ["fracture_boundary", "negative_space", "constraint_band", "anchor"],
  "boundary_conditions": [
    "范式透镜适合处理深层语言和标准冲突，不适合解释普通证据不足。",
    "不可通约不等于不可比较；仍可比较预测力、解释范围和代价。",
    "过早诉诸范式会遮蔽可解决的事实分歧。"
  ],
  "anti_misuse_rules": [
    "不要把任何争论都升级成范式冲突。",
    "不要用不可通约逃避证据审计。",
    "不要默认元模型自己的制图语言超越所有范式。"
  ],
  "model_training_notes": [
    "元模型要先翻译问题定义，再比较结论。",
    "对无法平均的冲突，输出多个候选轮廓而非强行综合。",
    "元模型要寻找不同范式都无法命名的变量，那往往是真正负空间。"
  ],
  "self_reflection": [
    "元模型是否默认自己的制图语言就是中性语言？",
    "元模型是否把不可通约冲突错误地翻译成普通分歧？"
  ]
}
